### ISSUE TITLE
GS105Ev2

### ISSUE THREAD

**Issue by Claude-Fentange** [ckarrie/ha-netgear-plus#21]
With the last update, and before i never tested.
GS105Ev2
Following error:

2024-07-06 10:41:57.553 ERROR (MainThread) [custom_components.ckw_hass_gs108e] Unexpected error fetching GS105Ev2 192.168.1.252 Switch infos data
Traceback (most recent call last):
  File "/usr/src/homeassistant/homeassistant/helpers/update_coordinator.py", line 312, in _async_refresh
    self.data = await self._async_update_data()
                ^^^^^^^^^^^^^^^^^^^^^^^^^^^^^^^
  File "/usr/src/homeassistant/homeassistant/helpers/update_coordinator.py", line 268, in _async_update_data
    return await self.update_method()
           ^^^^^^^^^^^^^^^^^^^^^^^^^^
  File "/config/custom_components/ckw_hass_gs108e/__init__.py", line 57, in async_update_switch_infos
    return await gs_switch.async_get_switch_infos()
           ^^^^^^^^^^^^^^^^^^^^^^^^^^^^^^^^^^^^^^^^
  File "/config/custom_components/ckw_hass_gs108e/netgear_switch.py", line 77, in async_get_switch_infos
    return await self.hass.async_add_executor_job(self.api.get_switch_infos)
           ^^^^^^^^^^^^^^^^^^^^^^^^^^^^^^^^^^^^^^^^^^^^^^^^^^^^^^^^^^^^^^^^^
  File "/usr/local/lib/python3.12/concurrent/futures/thread.py", line 58, in run
    result = self.fn(*self.args, **self.kwargs)
             ^^^^^^^^^^^^^^^^^^^^^^^^^^^^^^^^^^
  File "/config/custom_components/ckw_hass_gs108e/gs108e/__init__.py", line 509, in get_switch_infos
    switch_firmware = tree.xpath('//table[@id="tbl1"]/tr[6]/td[2]')[0].text
                      ~~~~~~~~~~~~~~~~~~~~~~~~~~~~~~~~~~~~~~~~~~~~~^^^
IndexError: list index out of range

**Comment by ckarrie** [comment]
Unfortunately I don't own a GS105Ev2 but I guess the functionality could be the same as the GS108Ev2 but with 5 Ports.

Could you provide the output of "http://{ip}/switch_info.htm" so I can take a look at the table structure? If "http://{ip}/switch_info.htm" fails to open, try "http://{ip}/switch_info.cgi" and tell me which URL works.

**Comment by Claude-Fentange** [comment]
Good morning,

I tested your sugestion,


Switch Information 	

Product Name 	GS105Ev2
Switch Name 	
Serial Number 	3MXD175D022A8
MAC Address 	80:CC:9C:96:51:53
Bootloader Version 	V1.6.0.2-VB
Firmware Version 	V1.6.0.11
DHCP Mode 	
 Refresh
IP Address 	
Subnet Mask 	
Gateway Address 	


Only the http://{ip}/switch_info.cgi is working, but I have to be logged In.

Kind Regards

Claude DE PRYCK

**Comment by johan-de-jong** [comment]
Does this help?

<pre>
2024-07-08 18:07:17.199 INFO (SyncWorker_14) [custom_components.ckw_hass_gs108e.gs108e] [NetgearSwitchConnector.autodetect_model] called for IP=www.xxx.yyy.zzz
2024-07-08 18:07:17.200 INFO (SyncWorker_14) [custom_components.ckw_hass_gs108e.gs108e] [NetgearSwitchConnector.check_login_url] calling request for url=http://www.xxx.yyy.zzz/login.cgi
2024-07-08 18:07:17.344 INFO (SyncWorker_14) [custom_components.ckw_hass_gs108e.gs108e] [NetgearSwitchConnector.autodetect_model] passed_checks_by_model={'GS105E': {'check_login_form_rand': True, 'check_login_title_tag': False}, 'GS105Ev2': {'check_login_form_rand': True, 'check_login_title_tag': True}, 'GS108E': {'check_login_form_rand': True, 'check_login_title_tag': False, 'check_login_switchinfo_tag': False}, 'GS108Ev3': {'check_login_form_rand': True, 'check_login_title_tag': False, 'check_login_switchinfo_tag': False}, 'GS305EP': {'check_login_form_rand': True, 'check_login_title_tag': False}, 'GS308EP': {'check_login_form_rand': True, 'check_login_title_tag': False}, 'GS316EP': {'check_login_form_rand': True, 'check_login_title_tag': False}, 'GS316EPP': {'check_login_form_rand': True, 'check_login_title_tag': False}} matched_models=[<custom_components.ckw_hass_gs108e.gs108e.models.GS105Ev2 object at 0x7f217c9040>]
2024-07-08 18:07:17.345 INFO (SyncWorker_14) [custom_components.ckw_hass_gs108e.gs108e] [NetgearSwitchConnector.get_login_cookie] calling request.post for url=http://www.xxx.yyy.zzz/login.cgi with login_password=860b69492f494534f01d5801fbfc7890
2024-07-08 18:07:17.507 WARNING (SyncWorker_14) [custom_components.ckw_hass_gs108e.gs108e] [ckw_hass_gs108e.get_login_cookie] [IP: 172.28.129.243] Response from switch: "[]"
</pre>

**GS105Ev2**
![image](https://github.com/ckarrie/ckw-ha-gs108e/assets/38002717/5a71b714-3a91-4624-b5c1-6e1eeac96d22)

**GS116Ev2**
![image](https://github.com/ckarrie/ckw-ha-gs108e/assets/38002717/a52d1300-3d0b-4060-bfa0-bbd6ca29af62)

**Comment by Claude-Fentange** [comment]
Yes that is exactly the situation, the switch is correctly discovered, after setup is still "Failed to setup".
![Capture d’écran 2024-07-08 174259](https://github.com/ckarrie/ckw-ha-gs108e/assets/9633183/71c96588-39fd-48bb-9f43-1538598a6a72)
![Capture d’écran 2024-07-08 174640](https://github.com/ckarrie/ckw-ha-gs108e/assets/9633183/d5f0d0f2-abed-4f7b-a2d0-a8fbad9d1df5)

**Comment by johan-de-jong** [comment]
I did a tcpdump traffic dump. See below.

I get this error message: '\<div id="pwdErr" class="pwdErrStyle">**The maximum number of sessions has been reached. Wait a few minutes and then try again.**\</div>'

I will check again in a couple of hours.

<pre>
18:55:38.181625 IP www.xxx.yyy.zzz.46148 > www.xxx.yyy.nnn.80: Flags [P.], seq 1:229, ack 1, win 32120, length 228: HTTP: POST /login.cgi HTTP/1.1
E...t.@.@.io.........D.P........P.}x\...POST /login.cgi HTTP/1.1
Host: www.xxx.yyy.nnn
User-Agent: python-requests/2.32.3
Accept-Encoding: gzip, deflate, br
Accept: */*
Connection: keep-alive
Content-Length: 41
Content-Type: application/x-www-form-urlencoded


18:55:38.181668 IP www.xxx.yyy.zzz.46148 > www.xxx.yyy.nnn.80: Flags [P.], seq 229:270, ack 1, win 32120, length 41: HTTP
E..Qt.@.@.j).........D.P........P.}x\...password=xxx

18:55:38.299626 IP www.xxx.yyy.nnn.80 > www.xxx.yyy.zzz.46148: Flags [.], seq 1:1461, ack 270, win 1460, length 1460: HTTP: HTTP/1.1 200 OK
E....C@.@............P.D........P.......HTTP/1.1 200 OK
Connection: close
X-Frame-Options: SAMEORIGIN
X-XSS-Protection: 1; mode=block
X-Content-Type-Options: nosniff
Content-Type: text/html

<!DOCTYPE html>
<html>
<head>
<meta http-equiv="Content-Type" content="text/html; charset=UTF-8">
<meta http-equiv="X-UA-Compatible" content="IE=edge,chrome=1">
<link rel="stylesheet" type="text/css" href="/login.css?a1.6.0.11">
<title>NETGEAR GS105Ev2</title>
<script src="/jquery.md5.js?a1.6.0.11" type="text/javascript"></script>
<script src="/login.js?a1.6.0.11" type="text/javascript"></script>
<script language="JavaScript">
function submitLogin()
{
    encryptPwd();
	document.forms[0].submit();
	return true;
}
</script>
</head>
<body onload="init();changeLoginButtonStyle();">
<div id="mainArea" class="mainArea">
  <div id="mainTitleArea" class="mainTitleArea">
   <img class="customGraph" src="/CBU_NgrLogo.png">
   <img class="factGraph" src="/CBU_IMG_ContentVisual.png">
   <div class="switchInfo">GS105Ev2 &ndash; 5-Port Gigabit Ethernet Smart Managed Plus Switch</div>
  </div>
  <div id="loginContainer" class="loginContainer">
   <form method="post" action="/login.cgi" name="login" onSubmit="return false;">
   <input id="submitPwd" name="password" type="hidden" value="">
    <div id="contentArea">
	 <div id="loginArea" class="loginArea">
	  <div id="loginTitleArea">
	   <table>
		<tr>
		<script>tbhdrLoginTable('Login','login');</script>
		</tr>
		<tr>
		 <td colspa

18:55:38.321691 IP www.xxx.yyy.nnn.80 > www.xxx.yyy.zzz.46148: Flags [.], seq 1461:2921, ack 270, win 1460, length 1460: HTTP
E....D@.@............P.D........P...9o..ble>
		   <tr>
		    <td class="topLoginTitleBottomBar"></td>
		   </tr>
		  </table>
		 </td>
		</tr>
	   </table>
	  </div>
	  <div id="loginBlkbArea" class="bClass">
	   <div id="loginDiv" class="loginBox">
	    <div id="loginTDataArea" class="tableData mTop25">
	     <table id="loginTData">
	      <tbody>
	       <tr>
		  <td width="23px"><div></div></td>
		  <td width="100px" style='white-space:nowrap'>
		   <div class="colInterval textLeft">Password</div>
		  </td>
		  <td width="290px">
		   <input id="password" class="textInputStyle textInputLength" onkeypress="onEnterSub(event);" type="password" maxlength="20" style="border:1px #CCCCCC solid;" autocomplete="off">
		  </td>
		  <td width="23px"><div></div></td>
              </tr>
              <tr>
                <td width="23px"><div></div></td>
                <td width="100px"><div></div></td>
                <td width="290px">
<div id="pwdErr" class="pwdErrStyle">The maximum number of sessions has been reached. Wait a few minutes and then try again.</div>
                </td>
                <td width="23px"><div></div></td>
              </tr>
             <tr>
               <td width="23px"><div></div></td>
               <td width="100px"><div></div></td>
               <td width="290px">
                 <a id="loginBtn" class="loginBtnStyle" href="javascript:submitLogin()">Login</a>
               </td>
               <td width="23px"><div></div></td>


18:55:38.330082 IP www.xxx.yyy.nnn.80 > www.xxx.yyy.zzz.46148: Flags [.], seq 2921:3357, ack 270, win 1460, length 436: HTTP
E....E@.@............P.D...i....P......./tr>
           </tbody>
         </table>
       </div></div></div></div></div>
       <input type=hidden id='rand' value='309412878' disabled>     </form>
   </div>
         <div class="footerImg">
          <div class="copyrightGraphWrap">
           <span>&copy; NETGEAR, Inc. All rights reserved.</span>
          </div>
          <img style="float:right;" src="/Footer_Facet_Graphic.png">
         </div>
  </div>
</body>
</html>




</pre>

**Comment by johan-de-jong** [comment]
The other session has timed-out. The ckw-ha-gs108e integration can now communicate with the GS105E.
I captured the http traffic between Home Assistant and the Netgear. See below. I changed the smaller / larger than symbols to braces {} because the editor kept on trying to parse the html tags.

<pre>
19:21:40.525598 IP aaa.bbb.ccc.ddd.48626 } www.xxx.yyy.zzz.80: Flags [P.], seq 1:259, ack 1, win 32120, length 258: HTTP: GET /switch_info.htm HTTP/1.1
Host: www.xxx.yyy.zzz
User-Agent: python-requests/2.32.3
Accept-Encoding: gzip, deflate, br
Accept: */*
Connection: keep-alive
Cookie: SID=\Ob^HMoBjqxxxx

19:21:40.597490 IP www.xxx.yyy.zzz.80 } aaa.bbb.ccc.ddd.48626: Flags [.], seq 1:143, ack 259, win 1460, length 142: HTTP: HTTP/1.1 404 Not found
E.....@.@............P.........aP.......HTTP/1.1 404 Not found
Connection: close
X-Frame-Options: SAMEORIGIN
X-XSS-Protection: 1; mode=block
X-Content-Type-Options: nosniff

19:21:40.610591 IP aaa.bbb.ccc.ddd.48630 } www.xxx.yyy.zzz.80: Flags [P.], seq 1:259, ack 1, win 32120, length 258: HTTP: GET /switch_info.cgi HTTP/1.1
E..*.g@.@.;............PT.......P.}x\...GET /switch_info.cgi HTTP/1.1
Host: www.xxx.yyy.zzz
User-Agent: python-requests/2.32.3
Accept-Encoding: gzip, deflate, br
Accept: */*
Connection: keep-alive
Cookie: SID=\Ob^HMoBxxxx

19:21:40.697160 IP www.xxx.yyy.zzz.80 } aaa.bbb.ccc.ddd.48630: Flags [.], seq 1:1461, ack 259, win 1460, length 1460: HTTP: HTTP/1.1 200 OK
E.....@.@............P......T...P....x..HTTP/1.1 200 OK
Connection: close
X-Frame-Options: SAMEORIGIN
X-XSS-Protection: 1; mode=block
X-Content-Type-Options: nosniff
Content-Type: text/html
Cache-Control: no-cache
Expires: -1

{!DOCTYPE html}
{html}
{head}
{meta http-equiv="Content-Type" content="text/html; charset=UTF-8"}
{meta http-equiv="X-UA-Compatible" content="IE=edge,chrome=1"}
{title}Switch Information{/title}
{link rel="stylesheet" type="text/css" href="/style.css?a1.6.0.11"}
{script src="/frame.js?a1.6.0.11" type="text/javascript"}{/script}
{script src="/function.js?a1.6.0.11" type="text/javascript"}{/script}
{script language="JavaScript"}
function getCookie(){
   var aCookie = document.cookie.split(";");
   for (var i = 0;i {aCookie.length;i++)
   {
    console.log(aCookie[i]);
   }
  }
function selectOptions()
{
    var dhcp_mode = document.getElementById('dhcpMode');
	if (dhcp_mode.options[0].selected == true)
	{
		document.forms[0].elements.refresh.disabled = true;
		document.forms[0].elements.ip_address.disabled = false;
		document.forms[0].elements.subnet_mask.disabled = false;
		document.forms[0].elements.gateway_address.disabled = false;
	}
	else if (dhcp_mode.options[1].selected == true)
	{
		document.forms[0].elements.refresh.disabled = false;
		document.forms[0].elements.ip_address.disabled = true;
		document.forms[0].elements.subnet_mask.disabled = true;
		document.forms[0].elements.gateway_address.disabled = true;
	}
}
function dh

19:21:40.721145 IP www.xxx.yyy.zzz.80 } aaa.bbb.ccc.ddd.48630: Flags [.], seq 1461:2921, ack 259, win 1460, length 1460: HTTP
{
	var dhcp_mode = document.getElementById('dhcpMode');
	if (dhcp_mode.options[0].selected == true)
	{
		document.forms[0].elements.refresh.disabled = true;
		document.forms[0].elements.ip_address.disabled = false;
		document.forms[0].elements.subnet_mask.disabled = false;
		document.forms[0].elements.gateway_address.disabled = false;
	}
	else if (dhcp_mode.options[1].selected == true)
	{
		document.forms[0].elements.refresh.disabled = false;
		document.forms[0].elements.ip_address.disabled = true;
		document.forms[0].elements.subnet_mask.disabled = true;
		document.forms[0].elements.gateway_address.disabled = true;
	}
	popUpWindown('alert','DHCP Mode','Note: Changing the protocol mode will reset the IP configuration.');
}
function changeRefreshVal()
{
	var re_fresh = document.getElementById('refresh');
	if (re_fresh.checked)
	{
		re_fresh.value = "1";
	}
	else
	{
		re_fresh.value = "0";
	}
}
{/script}
{/head}
{body onload="initErrMsg('Switch Information');selectOptions();getCookie()"}
{form method="post" action="/switch_info.cgi"}
{table class="detailsAreaContainer"}
{tr}
{td}{table class="tableStyle"}
{tr}
{script}tbhdrTable('Switch Information', 'switchInformation');{/script}
{/tr}{tr}{td class="topTitleBottomBar" colspan='2'}{/td}{/tr}
{tr}{td class="paddingTableBody" colspan='2'}{table class="tableStyle" id="tbl2" style="width:728px;"}
 {tr}
  {td width='300' class="padding14Top"}Product Name{/td}
  {td align="center
19:21:40.721288 IP aaa.bbb.ccc.ddd.48630 } www.xxx.yyy.zzz.80: Flags [.], ack 2921, win 30660, length 0

19:21:40.767252 IP www.xxx.yyy.zzz.80 } aaa.bbb.ccc.ddd.48630: Flags [.], seq 2921:4381, ack 259, win 1460, length 1460: HTTP
E.....@.@............P.....iT...P.......Ev2{/td}
 {/tr}
 {tr}
  {td class="padding14Top"}Switch Name{/td}
  {td  align="center" nowrap}
  {input type="text" name="switch_name" id="switch_name" value="" size="15" maxlength="20" onmousedown="enableImage();" onkeypress="enableImage();" /}
 {/td}{/tr}
 {tr}
  {td class="padding14Top"}Serial Number{/td}
  {td  align="center" nowrap}xxx{/td}
 {/tr}
 {tr}
  {td class="padding14Top"}MAC Address{/td}
  {td  align="center" nowrap}xx:xx:xx:xx:xx:xx{/td}
 {/tr}
 {tr}
  {td class="padding14Top"}Firmware Version{/td}
  {td  align="center" nowrap}V1.6.0.11{/td}
 {/tr}
 {tr}
  {td class="padding14Top"}DHCP Mode{/td}
  {td  align="center" nowrap}
  {select name="dhcpMode" id="dhcpMode" style="width:145px;" onchange="enableImage();dhcpModeChange();"}
  {option value="0"}Disable{/option}
  {option value="1" selected}Enable{/option}
  {/select}
  {input type="checkbox" id="refresh" name="refresh" value="0" style="margin-left:5px;margin-right:5px;" onclick="enableImage();changeRefreshVal()"}{span}Refresh{/span}
  {/td}
 {/tr}
 {tr}
  {td class="padding14Top"}IP Address{/td}
  {td  align="center" nowrap}
  {input type="text" name="ip_address" id="ip_address" value="www.xxx.yyy.zzz" size="15" maxlength="15" onmousedown="enableImage();" onkeypress="enableImage();"}
  {/td}
 {/tr}
 {tr}
  {td class="padding14Top"}Subnet Mask{/td}
  {td  align="center" nowrap}
  {input type="text" name="subnet_mask" id="subnet_mask" value="255.2

19:21:40.784993 IP www.xxx.yyy.zzz.80 } aaa.bbb.ccc.ddd.48630: Flags [.], seq 4381:5140, ack 259, win 1460, length 759: HTTP
E.....@.@..H.........P......T...P....T..ze="15" maxlength="15" onmousedown="enableImage();" onkeypress="enableImage();"}
  {/td}
 {/tr}
 {tr}
  {td class="padding14Top"}Gateway Address{/td}
  {td  align="center" nowrap}
  {input type="text" name="gateway_address" id="gateway_address" value="xxx.xxx.xxx.xxx" size="15" maxlength="15" onmousedown="enableImage();" onkeypress="enableImage();"}
  {/td}
 {/tr}
{input type=hidden name='hash' id='hash' value="6269"}
{input type=hidden name='err_msg' id='err_msg' value='' disabled}
 {/table}{/td}{/tr}
{/table}{/td}{/tr}
{/table}{/form}
{script}
var str = CreateButtons('button','Cancel','javaScript:void(0)','btn_Cancel','off');
str += CreateButtons('button','Apply','javaScript:void(0)','btn_Apply','off');
PaintButtons(str);
{/script}
{/body}
{/html}

19:21:46.286333 IP aaa.bbb.ccc.ddd.49534 } www.xxx.yyy.zzz.80: Flags [P.], seq 1:159, ack 1, win 32120, length 158: HTTP: GET /login.cgi HTTP/1.1
E....{@.@............~.P...r....P.}x\...GET /login.cgi HTTP/1.1
Host: www.xxx.yyy.zzz
User-Agent: python-requests/2.32.3
Accept-Encoding: gzip, deflate, br
Accept: */*
Connection: keep-alive


19:21:46.289144 IP www.xxx.yyy.zzz.80 } aaa.bbb.ccc.ddd.49534: Flags [.], ack 159, win 1460, length 0
E..(..@.@..;.........P.~........P...}.........
19:21:46.350409 IP www.xxx.yyy.zzz.80 } aaa.bbb.ccc.ddd.49534: Flags [.], seq 1:1461, ack 159, win 1460, length 1460: HTTP: HTTP/1.1 200 OK
E.....@.@............P.~........P.......HTTP/1.1 200 OK
Connection: close
X-Frame-Options: SAMEORIGIN
X-XSS-Protection: 1; mode=block
X-Content-Type-Options: nosniff
Content-Type: text/html

{!DOCTYPE html}
{html}
{head}
{meta http-equiv="Content-Type" content="text/html; charset=UTF-8"}
{meta http-equiv="X-UA-Compatible" content="IE=edge,chrome=1"}
{link rel="stylesheet" type="text/css" href="/login.css?a1.6.0.11"}
{title}NETGEAR GS105Ev2{/title}
{script src="/jquery.md5.js?a1.6.0.11" type="text/javascript"}{/script}
{script src="/login.js?a1.6.0.11" type="text/javascript"}{/script}
{script language="JavaScript"}
function submitLogin()
{
    encryptPwd();
	document.forms[0].submit();
	return true;
}
{/script}
{/head}
{body onload="init();changeLoginButtonStyle();"}
{div id="mainArea" class="mainArea"}
  {div id="mainTitleArea" class="mainTitleArea"}
   {img class="customGraph" src="/CBU_NgrLogo.png"}
   {img class="factGraph" src="/CBU_IMG_ContentVisual.png"}
   {div class="switchInfo"}GS105Ev2 &ndash; 5-Port Gigabit Ethernet Smart Managed Plus Switch{/div}
  {/div}
  {div id="loginContainer" class="loginContainer"}
   {form method="post" action="/login.cgi" name="login" onSubmit="return false;"}
   {input id="submitPwd" name="password" type="hidden" value=""}
    {div id="contentArea"}
	 {div id="loginArea" class="loginArea"}
	  {div id="loginTitleArea"}
	   {table}
		{tr}
		{script}tbhdrLoginTable('Login','login');{/script}
		{/tr}
		{tr}
		 {td colspa
19:21:46.350531 IP aaa.bbb.ccc.ddd.49534 } www.xxx.yyy.zzz.80: Flags [.], ack 1461, win 30660, length 0
E..(.=@.@............~.P........P.w.[...
19:21:46.374790 IP www.xxx.yyy.zzz.80 } aaa.bbb.ccc.ddd.49534: Flags [.], seq 1461:2921, ack 159, win 1460, length 1460: HTTP
E.....@.@............P.~........P.......ble}
		   {tr}
		    {td class="topLoginTitleBottomBar"}{/td}
		   {/tr}
		  {/table}
		 {/td}
		{/tr}
	   {/table}
	  {/div}
	  {div id="loginBlkbArea" class="bClass"}
	   {div id="loginDiv" class="loginBox"}
	    {div id="loginTDataArea" class="tableData mTop25"}
	     {table id="loginTData"}
	      {tbody}
	       {tr}
		  {td width="23px"}{div}{/div}{/td}
		  {td width="100px" style='white-space:nowrap'}
		   {div class="colInterval textLeft"}Password{/div}
		  {/td}
		  {td width="290px"}
		   {input id="password" class="textInputStyle textInputLength" onkeypress="onEnterSub(event);" type="password" maxlength="20" style="border:1px #CCCCCC solid;" autocomplete="off"}
		  {/td}
		  {td width="23px"}{div}{/div}{/td}
              {/tr}
              {tr}
                {td width="23px"}{div}{/div}{/td}
                {td width="100px"}{div}{/div}{/td}
                {td width="290px"}
{div id="pwdErr" class="pwdErrStyle"}{/div}
                {/td}
                {td width="23px"}{div}{/div}{/td}
              {/tr}
             {tr}
               {td width="23px"}{div}{/div}{/td}
               {td width="100px"}{div}{/div}{/td}
               {td width="290px"}
                 {a id="loginBtn" class="loginBtnStyle" href="javascript:submitLogin()"}Login{/a}
               {/td}
               {td width="23px"}{div}{/div}{/td}
             {/tr}
           {/tbody}
         {/table}
       {/div}{/div}{/div}{/div
19:21:46.374904 IP aaa.bbb.ccc.ddd.49534 } www.xxx.yyy.zzz.80: Flags [.], ack 2921, win 30660, length 0
E..(.}@.@............~.P.......iP.w.[...
19:21:46.378908 IP www.xxx.yyy.zzz.80 } aaa.bbb.ccc.ddd.49534: Flags [.], seq 2921:3270, ack 159, win 1460, length 349: HTTP
E.....@.@............P.~...i....P....V.. {input type=hidden id='rand' value='309412878' disabled}     {/form}
   {/div}
         {div class="footerImg"}
          {div class="copyrightGraphWrap"}
           {span}&copy; NETGEAR, Inc. All rights reserved.{/span}
          {/div}
          {img style="float:right;" src="/Footer_Facet_Graphic.png"}
         {/div}
  {/div}
{/body}
{/html}

19:21:46.378950 IP aaa.bbb.ccc.ddd.49534 } www.xxx.yyy.zzz.80: Flags [.], ack 3270, win 30660, length 0
E..(.?@.@............~.P........P.w.[...
19:21:46.379682 IP www.xxx.yyy.zzz.80 } aaa.bbb.ccc.ddd.49534: Flags [F.], seq 3270, ack 159, win 1460, length 0
E..(..@.@..7.........P.~........P...1.........
19:21:46.380099 IP aaa.bbb.ccc.ddd.49534 } www.xxx.yyy.zzz.80: Flags [F.], seq 159, ack 3271, win 30660, length 0
E..(.@@.@............~.P........P.w.[...
19:21:46.384561 IP www.xxx.yyy.zzz.80 } aaa.bbb.ccc.ddd.49534: Flags [.], ack 160, win 1460, length 0
E..(..@.@..6.........P.~........P...1.........
19:21:46.403797 IP aaa.bbb.ccc.ddd.49536 } www.xxx.yyy.zzz.80: Flags [S], seq 1414152100, win 32120, options [mss 1460,sackOK,TS val 165221684 ecr 0,nop,wscale 7], length 0
E..{.)@.@.#............PTJ?.......}x[..........
	..4........
19:21:46.405901 IP www.xxx.yyy.zzz.80 } aaa.bbb.ccc.ddd.49536: Flags [S.], seq 268435456, ack 1414152101, win 1460, options [mss 1460], length 0
E..,..@.@..1.........P......TJ?.`.............
19:21:46.406002 IP aaa.bbb.ccc.ddd.49536 } www.xxx.yyy.zzz.80: Flags [.], ack 1, win 32120, length 0
E..(.*@.@.#............PTJ?.....P.}x[...
19:21:46.406158 IP aaa.bbb.ccc.ddd.49536 } www.xxx.yyy.zzz.80: Flags [P.], seq 1:229, ack 1, win 32120, length 228: HTTP: POST /login.cgi HTTP/1.1
E....+@.@."............PTJ?.....P.}x\...POST /login.cgi HTTP/1.1
Host: www.xxx.yyy.zzz
User-Agent: python-requests/2.32.3
Accept-Encoding: gzip, deflate, br
Accept: */*
Connection: keep-alive
Content-Length: 41
Content-Type: application/x-www-form-urlencoded


19:21:46.406201 IP aaa.bbb.ccc.ddd.49536 } www.xxx.yyy.zzz.80: Flags [P.], seq 229:270, ack 1, win 32120, length 41: HTTP
E..Q.,@.@.#............PTJ@.....P.}x\...password=cca986a12cbf727bb52d84ab1c1452a9
19:21:46.408961 IP www.xxx.yyy.zzz.80 } aaa.bbb.ccc.ddd.49536: Flags [.], ack 229, win 1460, length 0
E..(..@.@..4.........P......TJ@.P.............
19:21:46.434866 IP www.xxx.yyy.zzz.80 } aaa.bbb.ccc.ddd.49536: Flags [.], ack 270, win 1460, length 0
E..(..@.@..3.........P......TJ@.P.............
19:21:46.524884 IP www.xxx.yyy.zzz.80 } aaa.bbb.ccc.ddd.49536: Flags [.], seq 1:1461, ack 270, win 1460, length 1460: HTTP: HTTP/1.1 200 OK
E.....@.@..~.........P......TJ@.P...Kh..HTTP/1.1 200 OK
Connection: close
X-Frame-Options: SAMEORIGIN
X-XSS-Protection: 1; mode=block
X-Content-Type-Options: nosniff
Content-Type: text/html

{!DOCTYPE html}
{html}
{head}
{meta http-equiv="Content-Type" content="text/html; charset=UTF-8"}
{meta http-equiv="X-UA-Compatible" content="IE=edge,chrome=1"}
{link rel="stylesheet" type="text/css" href="/login.css?a1.6.0.11"}
{title}NETGEAR GS105Ev2{/title}
{script src="/jquery.md5.js?a1.6.0.11" type="text/javascript"}{/script}
{script src="/login.js?a1.6.0.11" type="text/javascript"}{/script}
{script language="JavaScript"}
function submitLogin()
{
    encryptPwd();
	document.forms[0].submit();
	return true;
}
{/script}
{/head}
{body onload="init();changeLoginButtonStyle();"}
{div id="mainArea" class="mainArea"}
  {div id="mainTitleArea" class="mainTitleArea"}
   {img class="customGraph" src="/CBU_NgrLogo.png"}
   {img class="factGraph" src="/CBU_IMG_ContentVisual.png"}
   {div class="switchInfo"}GS105Ev2 &ndash; 5-Port Gigabit Ethernet Smart Managed Plus Switch{/div}
  {/div}
  {div id="loginContainer" class="loginContainer"}
   {form method="post" action="/login.cgi" name="login" onSubmit="return false;"}
   {input id="submitPwd" name="password" type="hidden" value=""}
    {div id="contentArea"}
	 {div id="loginArea" class="loginArea"}
	  {div id="loginTitleArea"}
	   {table}
		{tr}
		{script}tbhdrLoginTable('Login','login');{/script}
		{/tr}
		{tr}
		 {td colspa
19:21:46.524991 IP aaa.bbb.ccc.ddd.49536 } www.xxx.yyy.zzz.80: Flags [.], ack 1461, win 30660, length 0
E..(.-@.@.#............PTJ@.....P.w.[...
19:21:46.547080 IP www.xxx.yyy.zzz.80 } aaa.bbb.ccc.ddd.49536: Flags [.], seq 1461:2921, ack 270, win 1460, length 1460: HTTP
E.....@.@..}.........P......TJ@.P.......ble}
		   {tr}
		    {td class="topLoginTitleBottomBar"}{/td}
		   {/tr}
		  {/table}
		 {/td}
		{/tr}
	   {/table}
	  {/div}
	  {div id="loginBlkbArea" class="bClass"}
	   {div id="loginDiv" class="loginBox"}
	    {div id="loginTDataArea" class="tableData mTop25"}
	     {table id="loginTData"}
	      {tbody}
	       {tr}
		  {td width="23px"}{div}{/div}{/td}
		  {td width="100px" style='white-space:nowrap'}
		   {div class="colInterval textLeft"}Password{/div}
		  {/td}
		  {td width="290px"}
		   {input id="password" class="textInputStyle textInputLength" onkeypress="onEnterSub(event);" type="password" maxlength="20" style="border:1px #CCCCCC solid;" autocomplete="off"}
		  {/td}
		  {td width="23px"}{div}{/div}{/td}
              {/tr}
              {tr}
                {td width="23px"}{div}{/div}{/td}
                {td width="100px"}{div}{/div}{/td}
                {td width="290px"}
{div id="pwdErr" class="pwdErrStyle"}The maximum number of sessions has been reached. Wait a few minutes and then try again.{/div}
                {/td}
                {td width="23px"}{div}{/div}{/td}
              {/tr}
             {tr}
               {td width="23px"}{div}{/div}{/td}
               {td width="100px"}{div}{/div}{/td}
               {td width="290px"}
                 {a id="loginBtn" class="loginBtnStyle" href="javascript:submitLogin()"}Login{/a}
               {/td}
               {td width="23px"}{div}{/div}{/td}

19:21:46.547181 IP aaa.bbb.ccc.ddd.49536 } www.xxx.yyy.zzz.80: Flags [.], ack 2921, win 30660, length 0
E..(..@.@.#............PTJ@....iP.w.[...
19:21:46.555599 IP www.xxx.yyy.zzz.80 } aaa.bbb.ccc.ddd.49536: Flags [.], seq 2921:3357, ack 270, win 1460, length 436: HTTP
E.....@.@..|.........P.....iTJ@.P....M../tr}
           {/tbody}
         {/table}
       {/div}{/div}{/div}{/div}{/div}
       {input type=hidden id='rand' value='309412878' disabled}     {/form}
   {/div}
         {div class="footerImg"}
          {div class="copyrightGraphWrap"}
           {span}&copy; NETGEAR, Inc. All rights reserved.{/span}
          {/div}
          {img style="float:right;" src="/Footer_Facet_Graphic.png"}
         {/div}
  {/div}
{/body}
{/html}

19:21:46.555649 IP aaa.bbb.ccc.ddd.49536 } www.xxx.yyy.zzz.80: Flags [.], ack 3357, win 30660, length 0
E..(./@.@.#............PTJ@.....P.w.[...
19:21:46.556383 IP www.xxx.yyy.zzz.80 } aaa.bbb.ccc.ddd.49536: Flags [F.], seq 3357, ack 270, win 1460, length 0
E..(..@.@../.........P......TJ@.P....m........
19:21:46.556796 IP aaa.bbb.ccc.ddd.49536 } www.xxx.yyy.zzz.80: Flags [F.], seq 270, ack 3358, win 30660, length 0
E..(.0@.@.#............PTJ@.....P.w.[...
19:21:46.561253 IP www.xxx.yyy.zzz.80 } aaa.bbb.ccc.ddd.49536: Flags [.], ack 271, win 1460, length 0
E..(..@.@............P......TJ@.P....l........
19:21:56.829522 IP aaa.bbb.ccc.ddd.52156 } www.xxx.yyy.zzz.80: Flags [S], seq 1857888864, win 32120, options [mss 1460,sackOK,TS val 165232110 ecr 0,nop,wscale 7], length 0
E..{..@.@..J...........Pn."`......}x[..........
	.=.........
19:21:56.831702 IP www.xxx.yyy.zzz.80 } aaa.bbb.ccc.ddd.52156: Flags [S.], seq 268435456, ack 1857888865, win 1460, options [mss 1460], length 0
E..,..@.@..).........P......n."a`....o........
19:21:56.831839 IP aaa.bbb.ccc.ddd.52156 } www.xxx.yyy.zzz.80: Flags [.], ack 1, win 32120, length 0
E..(..@.@..]...........Pn."a....P.}x[...
19:21:56.831940 IP aaa.bbb.ccc.ddd.52156 } www.xxx.yyy.zzz.80: Flags [P.], seq 1:159, ack 1, win 32120, length 158: HTTP: GET /login.cgi HTTP/1.1
E.....@.@..............Pn."a....P.}x\...GET /login.cgi HTTP/1.1
Host: www.xxx.yyy.zzz
User-Agent: python-requests/2.32.3
Accept-Encoding: gzip, deflate, br
Accept: */*
Connection: keep-alive


19:21:56.834762 IP www.xxx.yyy.zzz.80 } aaa.bbb.ccc.ddd.52156: Flags [.], ack 159, win 1460, length 0
E..(..@.@..,.........P......n.".P.............
19:21:56.896006 IP www.xxx.yyy.zzz.80 } aaa.bbb.ccc.ddd.52156: Flags [.], seq 1:1461, ack 159, win 1460, length 1460: HTTP: HTTP/1.1 200 OK
E.....@.@..w.........P......n.".P...Dl..HTTP/1.1 200 OK
Connection: close
X-Frame-Options: SAMEORIGIN
X-XSS-Protection: 1; mode=block
X-Content-Type-Options: nosniff
Content-Type: text/html

{!DOCTYPE html}
{html}
{head}
{meta http-equiv="Content-Type" content="text/html; charset=UTF-8"}
{meta http-equiv="X-UA-Compatible" content="IE=edge,chrome=1"}
{link rel="stylesheet" type="text/css" href="/login.css?a1.6.0.11"}
{title}NETGEAR GS105Ev2{/title}
{script src="/jquery.md5.js?a1.6.0.11" type="text/javascript"}{/script}
{script src="/login.js?a1.6.0.11" type="text/javascript"}{/script}
{script language="JavaScript"}
function submitLogin()
{
    encryptPwd();
	document.forms[0].submit();
	return true;
}
{/script}
{/head}
{body onload="init();changeLoginButtonStyle();"}
{div id="mainArea" class="mainArea"}
  {div id="mainTitleArea" class="mainTitleArea"}
   {img class="customGraph" src="/CBU_NgrLogo.png"}
   {img class="factGraph" src="/CBU_IMG_ContentVisual.png"}
   {div class="switchInfo"}GS105Ev2 &ndash; 5-Port Gigabit Ethernet Smart Managed Plus Switch{/div}
  {/div}
  {div id="loginContainer" class="loginContainer"}
   {form method="post" action="/login.cgi" name="login" onSubmit="return false;"}
   {input id="submitPwd" name="password" type="hidden" value=""}
    {div id="contentArea"}
	 {div id="loginArea" class="loginArea"}
	  {div id="loginTitleArea"}
	   {table}
		{tr}
		{script}tbhdrLoginTable('Login','login');{/script}
		{/tr}
		{tr}
		 {td colspa
19:21:56.896119 IP aaa.bbb.ccc.ddd.52156 } www.xxx.yyy.zzz.80: Flags [.], ack 1461, win 30660, length 0
E..(..@.@..[...........Pn.".....P.w.[...
19:21:56.920392 IP www.xxx.yyy.zzz.80 } aaa.bbb.ccc.ddd.52156: Flags [.], seq 1461:2921, ack 159, win 1460, length 1460: HTTP
E.....@.@..v.........P......n.".P...,...ble}
		   {tr}
		    {td class="topLoginTitleBottomBar"}{/td}
		   {/tr}
		  {/table}
		 {/td}
		{/tr}
	   {/table}
	  {/div}
	  {div id="loginBlkbArea" class="bClass"}
	   {div id="loginDiv" class="loginBox"}
	    {div id="loginTDataArea" class="tableData mTop25"}
	     {table id="loginTData"}
	      {tbody}
	       {tr}
		  {td width="23px"}{div}{/div}{/td}
		  {td width="100px" style='white-space:nowrap'}
		   {div class="colInterval textLeft"}Password{/div}
		  {/td}
		  {td width="290px"}
		   {input id="password" class="textInputStyle textInputLength" onkeypress="onEnterSub(event);" type="password" maxlength="20" style="border:1px #CCCCCC solid;" autocomplete="off"}
		  {/td}
		  {td width="23px"}{div}{/div}{/td}
              {/tr}
              {tr}
                {td width="23px"}{div}{/div}{/td}
                {td width="100px"}{div}{/div}{/td}
                {td width="290px"}
{div id="pwdErr" class="pwdErrStyle"}{/div}
                {/td}
                {td width="23px"}{div}{/div}{/td}
              {/tr}
             {tr}
               {td width="23px"}{div}{/div}{/td}
               {td width="100px"}{div}{/div}{/td}
               {td width="290px"}
                 {a id="loginBtn" class="loginBtnStyle" href="javascript:submitLogin()"}Login{/a}
               {/td}
               {td width="23px"}{div}{/div}{/td}
             {/tr}
           {/tbody}
         {/table}
       {/div}{/div}{/div}{/div
19:21:56.920496 IP aaa.bbb.ccc.ddd.52156 } www.xxx.yyy.zzz.80: Flags [.], ack 2921, win 30660, length 0
E..(..@.@..Z...........Pn."....iP.w.[...
19:21:56.924520 IP www.xxx.yyy.zzz.80 } aaa.bbb.ccc.ddd.52156: Flags [.], seq 2921:3270, ack 159, win 1460, length 349: HTTP
E.....@.@............P.....in.".P...J9.. {input type=hidden id='rand' value='309412878' disabled}     {/form}
   {/div}
         {div class="footerImg"}
          {div class="copyrightGraphWrap"}
           {span}&copy; NETGEAR, Inc. All rights reserved.{/span}
          {/div}
          {img style="float:right;" src="/Footer_Facet_Graphic.png"}
         {/div}
  {/div}
{/body}
{/html}

19:21:56.924568 IP aaa.bbb.ccc.ddd.52156 } www.xxx.yyy.zzz.80: Flags [.], ack 3270, win 30660, length 0
E..(..@.@..Y...........Pn.".....P.w.[...
19:21:56.925294 IP www.xxx.yyy.zzz.80 } aaa.bbb.ccc.ddd.52156: Flags [F.], seq 3270, ack 159, win 1460, length 0
E..(..@.@..(.........P......n.".P.............
19:21:56.925666 IP aaa.bbb.ccc.ddd.52156 } www.xxx.yyy.zzz.80: Flags [F.], seq 159, ack 3271, win 30660, length 0
E..(..@.@..X...........Pn.".....P.w.[...
19:21:56.930192 IP www.xxx.yyy.zzz.80 } aaa.bbb.ccc.ddd.52156: Flags [.], ack 160, win 1460, length 0
E..(..@.@..'.........P......n.#.P.............
19:21:56.949756 IP aaa.bbb.ccc.ddd.52172 } www.xxx.yyy.zzz.80: Flags [S], seq 1565182503, win 32120, options [mss 1460,sackOK,TS val 165232230 ecr 0,nop,wscale 7], length 0
E..{Df@.@..............P]J.'......}x[..........
	.}f........
19:21:56.951824 IP www.xxx.yyy.zzz.80 } aaa.bbb.ccc.ddd.52172: Flags [S.], seq 268435456, ack 1565182504, win 1460, options [mss 1460], length 0
E..,..@.@..".........P......]J.(`...3.........
19:21:56.951898 IP aaa.bbb.ccc.ddd.52172 } www.xxx.yyy.zzz.80: Flags [.], ack 1, win 32120, length 0
E..(Dg@.@..............P]J.(....P.}x[...
19:21:56.951972 IP aaa.bbb.ccc.ddd.52172 } www.xxx.yyy.zzz.80: Flags [P.], seq 1:229, ack 1, win 32120, length 228: HTTP: POST /login.cgi HTTP/1.1
E...Dh@.@..............P]J.(....P.}x\...POST /login.cgi HTTP/1.1
Host: www.xxx.yyy.zzz
User-Agent: python-requests/2.32.3
Accept-Encoding: gzip, deflate, br
Accept: */*
Connection: keep-alive
Content-Length: 41
Content-Type: application/x-www-form-urlencoded


19:21:56.952014 IP aaa.bbb.ccc.ddd.52172 } www.xxx.yyy.zzz.80: Flags [P.], seq 229:270, ack 1, win 32120, length 41: HTTP
E..QDi@.@..v...........P]J......P.}x\...password=cca986a12cbf727bb52d84ab1c1452a9
19:21:56.954885 IP www.xxx.yyy.zzz.80 } aaa.bbb.ccc.ddd.52172: Flags [.], ack 229, win 1460, length 0
E..(..@.@..%.........P......]J..P...I.........
19:21:56.980797 IP www.xxx.yyy.zzz.80 } aaa.bbb.ccc.ddd.52172: Flags [.], ack 270, win 1460, length 0
E..(..@.@..$.........P......]J.5P...I.........
19:21:57.070808 IP www.xxx.yyy.zzz.80 } aaa.bbb.ccc.ddd.52172: Flags [.], seq 1:1461, ack 270, win 1460, length 1460: HTTP: HTTP/1.1 200 OK
E.....@.@..o.........P......]J.5P.......HTTP/1.1 200 OK
Connection: close
X-Frame-Options: SAMEORIGIN
X-XSS-Protection: 1; mode=block
X-Content-Type-Options: nosniff
Content-Type: text/html

{!DOCTYPE html}
{html}
{head}
{meta http-equiv="Content-Type" content="text/html; charset=UTF-8"}
{meta http-equiv="X-UA-Compatible" content="IE=edge,chrome=1"}
{link rel="stylesheet" type="text/css" href="/login.css?a1.6.0.11"}
{title}NETGEAR GS105Ev2{/title}
{script src="/jquery.md5.js?a1.6.0.11" type="text/javascript"}{/script}
{script src="/login.js?a1.6.0.11" type="text/javascript"}{/script}
{script language="JavaScript"}
function submitLogin()
{
    encryptPwd();
	document.forms[0].submit();
	return true;
}
{/script}
{/head}
{body onload="init();changeLoginButtonStyle();"}
{div id="mainArea" class="mainArea"}
  {div id="mainTitleArea" class="mainTitleArea"}
   {img class="customGraph" src="/CBU_NgrLogo.png"}
   {img class="factGraph" src="/CBU_IMG_ContentVisual.png"}
   {div class="switchInfo"}GS105Ev2 &ndash; 5-Port Gigabit Ethernet Smart Managed Plus Switch{/div}
  {/div}
  {div id="loginContainer" class="loginContainer"}
   {form method="post" action="/login.cgi" name="login" onSubmit="return false;"}
   {input id="submitPwd" name="password" type="hidden" value=""}
    {div id="contentArea"}
	 {div id="loginArea" class="loginArea"}
	  {div id="loginTitleArea"}
	   {table}
		{tr}
		{script}tbhdrLoginTable('Login','login');{/script}
		{/tr}
		{tr}
		 {td colspa
19:21:57.070948 IP aaa.bbb.ccc.ddd.52172 } www.xxx.yyy.zzz.80: Flags [.], ack 1461, win 30660, length 0
E..(Dj@.@..............P]J.5....P.w.[...
19:21:57.093006 IP www.xxx.yyy.zzz.80 } aaa.bbb.ccc.ddd.52172: Flags [.], seq 1461:2921, ack 270, win 1460, length 1460: HTTP
E.....@.@..n.........P......]J.5P....C..ble}
		   {tr}
		    {td class="topLoginTitleBottomBar"}{/td}
		   {/tr}
		  {/table}
		 {/td}
		{/tr}
	   {/table}
	  {/div}
	  {div id="loginBlkbArea" class="bClass"}
	   {div id="loginDiv" class="loginBox"}
	    {div id="loginTDataArea" class="tableData mTop25"}
	     {table id="loginTData"}
	      {tbody}
	       {tr}
		  {td width="23px"}{div}{/div}{/td}
		  {td width="100px" style='white-space:nowrap'}
		   {div class="colInterval textLeft"}Password{/div}
		  {/td}
		  {td width="290px"}
		   {input id="password" class="textInputStyle textInputLength" onkeypress="onEnterSub(event);" type="password" maxlength="20" style="border:1px #CCCCCC solid;" autocomplete="off"}
		  {/td}
		  {td width="23px"}{div}{/div}{/td}
              {/tr}
              {tr}
                {td width="23px"}{div}{/div}{/td}
                {td width="100px"}{div}{/div}{/td}
                {td width="290px"}
{div id="pwdErr" class="pwdErrStyle"}The maximum number of sessions has been reached. Wait a few minutes and then try again.{/div}
                {/td}
                {td width="23px"}{div}{/div}{/td}
              {/tr}
             {tr}
               {td width="23px"}{div}{/div}{/td}
               {td width="100px"}{div}{/div}{/td}
               {td width="290px"}
                 {a id="loginBtn" class="loginBtnStyle" href="javascript:submitLogin()"}Login{/a}
               {/td}
               {td width="23px"}{div}{/div}{/td}

19:21:57.093109 IP aaa.bbb.ccc.ddd.52172 } www.xxx.yyy.zzz.80: Flags [.], ack 2921, win 30660, length 0
E..(Dk@.@..............P]J.5...iP.w.[...
19:21:57.101514 IP www.xxx.yyy.zzz.80 } aaa.bbb.ccc.ddd.52172: Flags [.], seq 2921:3357, ack 270, win 1460, length 436: HTTP
E.....@.@..m.........P.....i]J.5P...|}../tr}
           {/tbody}
         {/table}
       {/div}{/div}{/div}{/div}{/div}
       {input type=hidden id='rand' value='309412878' disabled}     {/form}
   {/div}
         {div class="footerImg"}
          {div class="copyrightGraphWrap"}
           {span}&copy; NETGEAR, Inc. All rights reserved.{/span}
          {/div}
          {img style="float:right;" src="/Footer_Facet_Graphic.png"}
         {/div}
  {/div}
{/body}
{/html}

19:21:57.101571 IP aaa.bbb.ccc.ddd.52172 } www.xxx.yyy.zzz.80: Flags [.], ack 3357, win 30660, length 0
E..(Dl@.@..............P]J.5....P.w.[...
19:21:57.102307 IP www.xxx.yyy.zzz.80 } aaa.bbb.ccc.ddd.52172: Flags [F.], seq 3357, ack 270, win 1460, length 0
E..(..@.@.. .........P......]J.5P...{.........
19:21:57.102769 IP aaa.bbb.ccc.ddd.52172 } www.xxx.yyy.zzz.80: Flags [F.], seq 270, ack 3358, win 30660, length 0
E..(Dm@.@..............P]J.5....P.w.[...
19:21:57.107209 IP www.xxx.yyy.zzz.80 } aaa.bbb.ccc.ddd.52172: Flags [.], ack 271, win 1460, length 0
E..(..@.@............P......]J.6P...{.........
19:22:17.550023 IP aaa.bbb.ccc.ddd.45760 } www.xxx.yyy.zzz.80: Flags [S], seq 1134779956, win 32120, options [mss 1460,sackOK,TS val 165252830 ecr 0,nop,wscale 7], length 0
E..{.)@.@..............PC.^4......}x[..........
	...........
19:22:17.552178 IP www.xxx.yyy.zzz.80 } aaa.bbb.ccc.ddd.45760: Flags [S.], seq 268435456, ack 1134779957, win 1460, options [mss 1460], length 0
E..,..@.@............P......C.^5`.............
19:22:17.552359 IP aaa.bbb.ccc.ddd.45760 } www.xxx.yyy.zzz.80: Flags [.], ack 1, win 32120, length 0
E..(.*@.@..............PC.^5....P.}x[...
19:22:17.552617 IP aaa.bbb.ccc.ddd.45760 } www.xxx.yyy.zzz.80: Flags [P.], seq 1:159, ack 1, win 32120, length 158: HTTP: GET /login.cgi HTTP/1.1
E....+@.@..}...........PC.^5....P.}x\...GET /login.cgi HTTP/1.1
Host: www.xxx.yyy.zzz
User-Agent: python-requests/2.32.3
Accept-Encoding: gzip, deflate, br
Accept: */*
Connection: keep-alive


19:22:17.555242 IP www.xxx.yyy.zzz.80 } aaa.bbb.ccc.ddd.45760: Flags [.], ack 159, win 1460, length 0
E..(..@.@............P......C.^.P.............
19:22:17.616491 IP www.xxx.yyy.zzz.80 } aaa.bbb.ccc.ddd.45760: Flags [.], seq 1:1461, ack 159, win 1460, length 1460: HTTP: HTTP/1.1 200 OK
E.....@.@..h.........P......C.^.P...L...HTTP/1.1 200 OK
Connection: close
X-Frame-Options: SAMEORIGIN
X-XSS-Protection: 1; mode=block
X-Content-Type-Options: nosniff
Content-Type: text/html

{!DOCTYPE html}
{html}
{head}
{meta http-equiv="Content-Type" content="text/html; charset=UTF-8"}
{meta http-equiv="X-UA-Compatible" content="IE=edge,chrome=1"}
{link rel="stylesheet" type="text/css" href="/login.css?a1.6.0.11"}
{title}NETGEAR GS105Ev2{/title}
{script src="/jquery.md5.js?a1.6.0.11" type="text/javascript"}{/script}
{script src="/login.js?a1.6.0.11" type="text/javascript"}{/script}
{script language="JavaScript"}
function submitLogin()
{
    encryptPwd();
	document.forms[0].submit();
	return true;
}
{/script}
{/head}
{body onload="init();changeLoginButtonStyle();"}
{div id="mainArea" class="mainArea"}
  {div id="mainTitleArea" class="mainTitleArea"}
   {img class="customGraph" src="/CBU_NgrLogo.png"}
   {img class="factGraph" src="/CBU_IMG_ContentVisual.png"}
   {div class="switchInfo"}GS105Ev2 &ndash; 5-Port Gigabit Ethernet Smart Managed Plus Switch{/div}
  {/div}
  {div id="loginContainer" class="loginContainer"}
   {form method="post" action="/login.cgi" name="login" onSubmit="return false;"}
   {input id="submitPwd" name="password" type="hidden" value=""}
    {div id="contentArea"}
	 {div id="loginArea" class="loginArea"}
	  {div id="loginTitleArea"}
	   {table}
		{tr}
		{script}tbhdrLoginTable('Login','login');{/script}
		{/tr}
		{tr}
		 {td colspa
</pre>

**Comment by Claude-Fentange** [comment]
I have once again reproduced a situation that I had noticed and I think this may help to resolve the problem.

I have a GS108Ev3 and a GS105Ev2 in my network.

The Gs108Ev3 I can access through any Browser:
- Edge
- Firefox
- Opera
- Chrome

The Gs 105Ev2i can be accessed through the following Browsers:
- Edge
- Firefox
- Opera
but with Chrome I can't! The connection is established, I see the initial page for a second and immediately I am rejected and find myself again on the Login page. If the Modul GS108 HA ever uses a connection procedure similar to Chrome, this could explain the problem.

**Comment by johan-de-jong** [comment]
Maybe this helps? This fork does work for the GS105E: https://github.com/Lulubelle3/lb3-ha-gs105e

![image](https://github.com/ckarrie/ckw-ha-gs108e/assets/38002717/a144b50c-863a-49d1-b351-1eca4453b01e)

![image](https://github.com/ckarrie/ckw-ha-gs108e/assets/38002717/b5bc0053-6eff-4d18-b745-ee37c1bcf021)

**Comment by Claude-Fentange** [comment]
This integration doesn’t work either.

**Comment by Claude-Fentange** [comment]
after restarting the HA server severall hours later, it works. The GS105 is recognized.
Thanks for the support
![Capture d’écran 2024-07-09 161405](https://github.com/ckarrie/ckw-ha-gs108e/assets/9633183/025ece85-74d4-4c76-8493-496c176dece1)

**Comment by Claude-Fentange** [comment]
Yes, the GS105E integration works, but it is not as complete as the GS108 integration.
The GS105 integration does not have the port status and port speed and I would like to use that like with my GS108 integration.
That's why it would be great if the GS108 integration worked with the GS105Ev2 switch.

**Comment by foxey** [comment]
@Claude-Fentange, @johan-de-jong is this issue still relevant?

If so, could you install the py-netgear-plus library in a Python virtual environment and run this test for me:

```bash
python -mvenv venv
. ./venv/bin/activate  # or in Windows: \venv\Scripts\activate.bat
pip install py-netgear-plus # should be version 0.4.1
ngp-cli -dv identify SWITCH_IP_ADDRESS
ngp-cli -dvP YOUR_PASSWORD login SWITCH_IP_ADDRESS
ngp-cli -dv save
ngp-cli -dv collect
ngp-cli -dv logout
```
Please share the debug logging here and upload a zipfile with the pages collected in the `pages` folder.

**Comment by foxey** [comment]
Closed due to inactivity. The library has untested support for this model. Please reopen when you want me to troubleshoot any issues.
